{
  "country": "NL",
  "nodes": [
    {
      "id": "src-be-2023",
      "type": "doc",
      "title": "Northwind People \u2014 Hybrid work policy (BE, 2023)",
      "date": "2023-01-15",
      "owner": "Policy Office",
      "country": "BE",
      "body": "Invented rule: Belgium-based staff may work remotely up to 2 days per week.",
      "claims": [
        {
          "topic": "remote_work_days_per_week",
          "value": "2"
        }
      ],
      "supersedesIds": [],
      "referencesIds": []
    },
    {
      "id": "src-be-2025",
      "type": "doc",
      "title": "Northwind People \u2014 Hybrid work policy (BE, 2025)",
      "date": "2025-03-01",
      "owner": "Policy Office",
      "country": "BE",
      "body": "Invented rule: Belgium-based staff may work remotely up to 3 days per week. This document replaces the 2023 version.",
      "claims": [
        {
          "topic": "remote_work_days_per_week",
          "value": "3"
        }
      ],
      "supersedesIds": [
        "src-be-2023"
      ],
      "referencesIds": []
    },
    {
      "id": "src-teams-unlimited",
      "type": "teams",
      "title": "Teams \u2014 #belgium-office: \u201cunlimited remote is fine now\u201d",
      "date": "2025-06-10",
      "owner": "Alex",
      "country": "BE",
      "body": "Invented chat: \u201cIgnore the PDF, we all do unlimited WFH now.\u201d",
      "claims": [
        {
          "topic": "remote_work_days_per_week",
          "value": "unlimited"
        }
      ],
      "supersedesIds": [],
      "referencesIds": []
    },
    {
      "id": "src-nl-2024",
      "type": "doc",
      "title": "Northwind People \u2014 Hybrid work policy (NL, 2024)",
      "date": "2024-11-01",
      "owner": "Policy Office NL",
      "country": "NL",
      "body": "Invented rule: Netherlands-based staff may work remotely up to 4 days per week.",
      "claims": [
        {
          "topic": "remote_work_days_per_week",
          "value": "4"
        }
      ],
      "supersedesIds": [],
      "referencesIds": []
    },
    {
      "id": "src-wiki-orphan",
      "type": "doc",
      "title": "Internal wiki: hybrid days (unsigned page)",
      "date": "2024-05-20",
      "owner": null,
      "country": "ALL",
      "body": "Invented wiki stub with no owner. Still says 2 remote days per week.",
      "claims": [
        {
          "topic": "remote_work_days_per_week",
          "value": "2"
        }
      ],
      "supersedesIds": [],
      "referencesIds": []
    }
  ],
  "edges": [
    {
      "id": "e-sup-src-be-2025-src-be-2023",
      "from": "src-be-2025",
      "to": "src-be-2023",
      "type": "supersedes"
    },
    {
      "id": "e-con-src-nl-2024-src-wiki-orphan",
      "from": "src-nl-2024",
      "to": "src-wiki-orphan",
      "type": "contradicts"
    }
  ],
  "conflicts": [
    {
      "id": "c-value_mismatch-src-nl-2024-src-wiki-orphan",
      "sourceIds": [
        "src-nl-2024",
        "src-wiki-orphan"
      ],
      "topic": "remote_work_days_per_week",
      "reason": "value_mismatch",
      "severity": "medium"
    },
    {
      "id": "c-scope_mismatch-src-be-2023-src-nl-2024",
      "sourceIds": [
        "src-be-2023",
        "src-nl-2024"
      ],
      "topic": "remote_work_days_per_week",
      "reason": "scope_mismatch",
      "severity": "low"
    },
    {
      "id": "c-scope_mismatch-src-be-2025-src-nl-2024",
      "sourceIds": [
        "src-be-2025",
        "src-nl-2024"
      ],
      "topic": "remote_work_days_per_week",
      "reason": "scope_mismatch",
      "severity": "low"
    },
    {
      "id": "c-scope_mismatch-src-nl-2024-src-teams-unlimited",
      "sourceIds": [
        "src-nl-2024",
        "src-teams-unlimited"
      ],
      "topic": "remote_work_days_per_week",
      "reason": "scope_mismatch",
      "severity": "low"
    }
  ],
  "trust": {
    "src-be-2023": {
      "score": 17,
      "factors": [
        {
          "id": "authority",
          "label": "Source authority",
          "delta": 40.0,
          "detail": "Type 'doc' uses the configured authority weight."
        },
        {
          "id": "recency",
          "label": "Recency",
          "delta": 0.61,
          "detail": "Decays toward 0 as the source ages vs the newest source in the graph."
        },
        {
          "id": "has_owner",
          "label": "Named owner",
          "delta": 10.0,
          "detail": "Full credit if owner is present; none if the source is unsigned."
        },
        {
          "id": "scope_match",
          "label": "Scope match",
          "delta": -18.0,
          "detail": "Does not apply to work location NL (source country BE)."
        },
        {
          "id": "corroboration",
          "label": "Corroboration",
          "delta": 6.0,
          "detail": "1 other in-scope source(s) share a claim value."
        },
        {
          "id": "open_conflict_penalty",
          "label": "Open conflict penalty",
          "delta": -22.0,
          "detail": "Penalty if this source is part of any open conflict for this viewer."
        }
      ]
    },
    "src-be-2025": {
      "score": 22,
      "factors": [
        {
          "id": "authority",
          "label": "Source authority",
          "delta": 40.0,
          "detail": "Type 'doc' uses the configured authority weight."
        },
        {
          "id": "recency",
          "label": "Recency",
          "delta": 12.2,
          "detail": "Decays toward 0 as the source ages vs the newest source in the graph."
        },
        {
          "id": "has_owner",
          "label": "Named owner",
          "delta": 10.0,
          "detail": "Full credit if owner is present; none if the source is unsigned."
        },
        {
          "id": "scope_match",
          "label": "Scope match",
          "delta": -18.0,
          "detail": "Does not apply to work location NL (source country BE)."
        },
        {
          "id": "corroboration",
          "label": "Corroboration",
          "delta": 0.0,
          "detail": "0 other in-scope source(s) share a claim value."
        },
        {
          "id": "open_conflict_penalty",
          "label": "Open conflict penalty",
          "delta": -22.0,
          "detail": "Penalty if this source is part of any open conflict for this viewer."
        }
      ]
    },
    "src-teams-unlimited": {
      "score": 0,
      "factors": [
        {
          "id": "authority",
          "label": "Source authority",
          "delta": 12.0,
          "detail": "Type 'teams' uses the configured authority weight."
        },
        {
          "id": "recency",
          "label": "Recency",
          "delta": 18.0,
          "detail": "Decays toward 0 as the source ages vs the newest source in the graph."
        },
        {
          "id": "has_owner",
          "label": "Named owner",
          "delta": 10.0,
          "detail": "Full credit if owner is present; none if the source is unsigned."
        },
        {
          "id": "scope_match",
          "label": "Scope match",
          "delta": -18.0,
          "detail": "Does not apply to work location NL (source country BE)."
        },
        {
          "id": "corroboration",
          "label": "Corroboration",
          "delta": 0.0,
          "detail": "0 other in-scope source(s) share a claim value."
        },
        {
          "id": "open_conflict_penalty",
          "label": "Open conflict penalty",
          "delta": -22.0,
          "detail": "Penalty if this source is part of any open conflict for this viewer."
        }
      ]
    },
    "src-nl-2024": {
      "score": 52,
      "factors": [
        {
          "id": "authority",
          "label": "Source authority",
          "delta": 40.0,
          "detail": "Type 'doc' uses the configured authority weight."
        },
        {
          "id": "recency",
          "label": "Recency",
          "delta": 7.69,
          "detail": "Decays toward 0 as the source ages vs the newest source in the graph."
        },
        {
          "id": "has_owner",
          "label": "Named owner",
          "delta": 10.0,
          "detail": "Full credit if owner is present; none if the source is unsigned."
        },
        {
          "id": "scope_match",
          "label": "Scope match",
          "delta": 16.0,
          "detail": "Applies to work location NL (source country NL)."
        },
        {
          "id": "corroboration",
          "label": "Corroboration",
          "delta": 0.0,
          "detail": "0 other in-scope source(s) share a claim value."
        },
        {
          "id": "open_conflict_penalty",
          "label": "Open conflict penalty",
          "delta": -22.0,
          "detail": "Penalty if this source is part of any open conflict for this viewer."
        }
      ]
    },
    "src-wiki-orphan": {
      "score": 38,
      "factors": [
        {
          "id": "authority",
          "label": "Source authority",
          "delta": 40.0,
          "detail": "Type 'doc' uses the configured authority weight."
        },
        {
          "id": "recency",
          "label": "Recency",
          "delta": 4.07,
          "detail": "Decays toward 0 as the source ages vs the newest source in the graph."
        },
        {
          "id": "has_owner",
          "label": "Named owner",
          "delta": 0.0,
          "detail": "Full credit if owner is present; none if the source is unsigned."
        },
        {
          "id": "scope_match",
          "label": "Scope match",
          "delta": 16.0,
          "detail": "Applies to work location NL (source country ALL)."
        },
        {
          "id": "corroboration",
          "label": "Corroboration",
          "delta": 0.0,
          "detail": "0 other in-scope source(s) share a claim value."
        },
        {
          "id": "open_conflict_penalty",
          "label": "Open conflict penalty",
          "delta": -22.0,